{
  "schema_version": "didcomm-transcript-0.1",
  "specification_ids": [
    "didcomm-issue-credential-3",
    "didcomm-present-proof-3",
    "didcomm-report-problem-2",
    "didcomm-revocation-notification"
  ],
  "source": [
    "repos/cloud-agent/mercury/protocol-issue-credential",
    "repos/cloud-agent/mercury/protocol-present-proof",
    "repos/cloud-agent/mercury/protocol-report-problem",
    "repos/cloud-agent/mercury/protocol-revocation-notification",
    "repos/integration/README.md"
  ],
  "owner_crate": "identus-messaging",
  "participants": {
    "issuer": "did:peer:2.Ez6LSissuer",
    "holder": "did:peer:2.Ez6LSholder",
    "verifier": "did:peer:2.Ez6LSverifier"
  },
  "messages": [
    {
      "id": "issue-1",
      "type": "https://didcomm.org/issue-credential/3.0/offer-credential",
      "from": "did:peer:2.Ez6LSissuer",
      "to": ["did:peer:2.Ez6LSholder"],
      "thid": "issue-thread-1",
      "body": {
        "formats": ["jwt_vc_json", "sd_jwt_vc", "anoncreds"],
        "preview_ref": "fixture-preview"
      }
    },
    {
      "id": "issue-2",
      "type": "https://didcomm.org/issue-credential/3.0/request-credential",
      "from": "did:peer:2.Ez6LSholder",
      "to": ["did:peer:2.Ez6LSissuer"],
      "thid": "issue-thread-1",
      "body": {
        "requested_format": "jwt_vc_json"
      }
    },
    {
      "id": "issue-3",
      "type": "https://didcomm.org/issue-credential/3.0/issue-credential",
      "from": "did:peer:2.Ez6LSissuer",
      "to": ["did:peer:2.Ez6LSholder"],
      "thid": "issue-thread-1",
      "body": {
        "attachment_ref": "redacted-credential"
      }
    },
    {
      "id": "proof-1",
      "type": "https://didcomm.org/present-proof/3.0/request-presentation",
      "from": "did:peer:2.Ez6LSverifier",
      "to": ["did:peer:2.Ez6LSholder"],
      "thid": "proof-thread-1",
      "body": {
        "formats": ["jwt_vp_json", "sd_jwt_vc", "anoncreds"],
        "presentation_definition_ref": "fixture-presentation-definition"
      }
    },
    {
      "id": "proof-2",
      "type": "https://didcomm.org/present-proof/3.0/presentation",
      "from": "did:peer:2.Ez6LSholder",
      "to": ["did:peer:2.Ez6LSverifier"],
      "thid": "proof-thread-1",
      "body": {
        "attachment_ref": "redacted-presentation"
      }
    },
    {
      "id": "problem-1",
      "type": "https://didcomm.org/report-problem/2.0/problem-report",
      "from": "did:peer:2.Ez6LSverifier",
      "to": ["did:peer:2.Ez6LSholder"],
      "thid": "proof-thread-1",
      "body": {
        "code": "e.p.presentation_unverified",
        "comment": "fixture-safe negative path"
      }
    },
    {
      "id": "revoke-1",
      "type": "https://didcomm.org/revocation-notification/1.0/revoke",
      "from": "did:peer:2.Ez6LSissuer",
      "to": ["did:peer:2.Ez6LSholder"],
      "thid": "issue-thread-1",
      "body": {
        "credential_id": "fixture-credential-id",
        "reason": "fixture revocation"
      }
    }
  ],
  "expected_states": [
    "credential_offer_received",
    "credential_requested",
    "credential_issued",
    "presentation_requested",
    "presentation_submitted",
    "problem_report_recorded",
    "credential_revoked"
  ],
  "redaction_policy": "Credential and presentation attachments are references only; no claims, signatures, keys, tokens, or production identifiers."
}
