{
  "schema_version": "didcomm-transcript-0.1",
  "specification_ids": [
    "didcomm-oob-2",
    "didcomm-issue-credential-3",
    "didcomm-present-proof-3"
  ],
  "source": [
    "repos/sdk-ts/integration-tests/e2e-tests/features/connectionless_receive_jwt.feature",
    "repos/sdk-ts/integration-tests/e2e-tests/features/connectionless_proof_jwt.feature",
    "repos/sdk-kmp/tests/end-to-end/src/test/resources/features/connectionless_receive_jwt.feature",
    "repos/sdk-kmp/tests/end-to-end/src/test/resources/features/connectionless_proof_jwt.feature",
    "repos/cloud-agent/tests/integration-tests/src/test/resources/features/credential/jwt/issuance.feature",
    "repos/cloud-agent/tests/integration-tests/src/test/resources/features/credential/jwt/present_proof.feature",
    "repos/sdk-ts/docs/develop/sdk/tutorials/connectionless/ConnectionlessOffer.md",
    "repos/sdk-ts/docs/develop/sdk/tutorials/connectionless/ConnectionlessPresentation.md"
  ],
  "owner_crate": "identus-messaging",
  "participants": {
    "issuer": "did:peer:2.Ez6LSissuer",
    "holder": "did:peer:2.Ez6LSholder",
    "verifier": "did:peer:2.Ez6LSverifier"
  },
  "messages": [
    {
      "id": "connectionless-offer-oob-1",
      "type": "https://didcomm.org/out-of-band/2.0/invitation",
      "from": "did:peer:2.Ez6LSissuer",
      "to": ["did:peer:2.Ez6LSholder"],
      "body": {
        "goal_code": "issue-vc",
        "goal": "Issue Credential",
        "accept": ["didcomm/v2"]
      },
      "attachments": [
        {
          "id": "offer-attachment-1",
          "type": "https://didcomm.org/issue-credential/3.0/offer-credential",
          "format": "jwt_vc_json",
          "redacted": true
        }
      ]
    },
    {
      "id": "connectionless-request-credential-1",
      "type": "https://didcomm.org/issue-credential/3.0/request-credential",
      "from": "did:peer:2.Ez6LSholder",
      "to": ["did:peer:2.Ez6LSissuer"],
      "thid": "connectionless-issue-thread-1",
      "pthid": "connectionless-offer-oob-1",
      "body": {
        "requested_format": "jwt_vc_json"
      }
    },
    {
      "id": "connectionless-issue-credential-1",
      "type": "https://didcomm.org/issue-credential/3.0/issue-credential",
      "from": "did:peer:2.Ez6LSissuer",
      "to": ["did:peer:2.Ez6LSholder"],
      "thid": "connectionless-issue-thread-1",
      "pthid": "connectionless-offer-oob-1",
      "body": {
        "attachment_ref": "redacted-connectionless-jwt-credential"
      }
    },
    {
      "id": "connectionless-proof-oob-1",
      "type": "https://didcomm.org/out-of-band/2.0/invitation",
      "from": "did:peer:2.Ez6LSverifier",
      "to": ["did:peer:2.Ez6LSholder"],
      "body": {
        "goal_code": "verify-credential",
        "goal": "Request Presentation",
        "accept": ["didcomm/v2"]
      },
      "attachments": [
        {
          "id": "proof-request-attachment-1",
          "type": "https://didcomm.org/present-proof/3.0/request-presentation",
          "format": "jwt_vp_json",
          "redacted": true
        }
      ]
    },
    {
      "id": "connectionless-presentation-1",
      "type": "https://didcomm.org/present-proof/3.0/presentation",
      "from": "did:peer:2.Ez6LSholder",
      "to": ["did:peer:2.Ez6LSverifier"],
      "thid": "connectionless-proof-thread-1",
      "pthid": "connectionless-proof-oob-1",
      "body": {
        "attachment_ref": "redacted-connectionless-jwt-presentation"
      }
    }
  ],
  "expected_states": [
    "connectionless_credential_offer_invitation_created",
    "connectionless_credential_offer_accepted_without_connection",
    "connectionless_credential_issued_without_connection",
    "connectionless_proof_request_invitation_created",
    "connectionless_presentation_submitted_without_connection"
  ],
  "redaction_policy": "Credential and presentation attachments are references only; no claims, signatures, keys, tokens, or production identifiers."
}
